06:14:27.112314 IP (tos 0x10, ttl 64, id 8258, offset 0, flags [DF], proto TCP (6), length 116)
    10.150.0.6.22 > 74.125.177.39.47332: Flags [P.], cksum 0x06a7 (incorrect -> 0x51d6), seq 1281836098:1281836162, ack 3564965389, win 581, options [nop,nop,TS val 1262030 ecr 2414465504], length 64
06:14:27.112357 IP (tos 0x10, ttl 64, id 8259, offset 0, flags [DF], proto TCP (6), length 180)
    10.150.0.6.22 > 74.125.177.39.47332: Flags [P.], cksum 0x06e7 (incorrect -> 0x3fa4), seq 64:192, ack 1, win 581, options [nop,nop,TS val 1262030 ecr 2414465504], length 128
06:14:27.112384 IP (tos 0x10, ttl 64, id 8260, offset 0, flags [DF], proto TCP (6), length 116)
    10.150.0.6.22 > 74.125.177.39.47332: Flags [P.], cksum 0x06a7 (incorrect -> 0x4df1), seq 192:256, ack 1, win 581, options [nop,nop,TS val 1262030 ecr 2414465504], length 64
06:14:27.114839 IP (tos 0x0, ttl 108, id 63526, offset 0, flags [none], proto TCP (6), length 52)
    74.125.177.39.47332 > 10.150.0.6.22: Flags [.], cksum 0x20ee (correct), seq 1, ack 0, win 32680, options [nop,nop,TS val 2414465519 ecr 1262027], length 0
06:14:27.127473 IP (tos 0x0, ttl 108, id 63537, offset 0, flags [none], proto TCP (6), length 52)
    74.125.177.39.47332 > 10.150.0.6.22: Flags [.], cksum 0x209e (correct), seq 1, ack 64, win 32680, options [nop,nop,TS val 2414465532 ecr 1262030], length 0
06:14:27.127501 IP (tos 0x0, ttl 108, id 63538, offset 0, flags [none], proto TCP (6), length 52)
    74.125.177.39.47332 > 10.150.0.6.22: Flags [.], cksum 0x2026 (correct), seq 1, ack 192, win 32672, options [nop,nop,TS val 2414465532 ecr 1262030], length 0
06:14:27.127506 IP (tos 0x0, ttl 108, id 63539, offset 0, flags [none], proto TCP (6), length 52)
    74.125.177.39.47332 > 10.150.0.6.22: Flags [.], cksum 0x1fde (correct), seq 1, ack 256, win 32680, options [nop,nop,TS val 2414465532 ecr 1262030], length 0
06:14:32.228683 IP (tos 0x0, ttl 108, id 2355, offset 0, flags [none], proto TCP (6), length 116)
    74.125.177.35.43242 > 10.150.0.6.22: Flags [P.], cksum 0x8c15 (correct), seq 4049699247:4049699311, ack 1125883815, win 32680, options [nop,nop,TS val 298320641 ecr 1233577], length 64
06:14:32.228979 IP (tos 0x10, ttl 64, id 42742, offset 0, flags [DF], proto TCP (6), length 116)
    10.150.0.6.22 > 74.125.177.35.43242: Flags [P.], cksum 0x06a3 (incorrect -> 0xd1bc), seq 1:65, ack 64, win 405, options [nop,nop,TS val 1263310 ecr 298320641], length 64
06:14:32.243877 IP (tos 0x0, ttl 108, id 2359, offset 0, flags [none], proto TCP (6), length 52)
    74.125.177.35.43242 > 10.150.0.6.22: Flags [.], cksum 0x95ca (correct), seq 64, ack 65, win 32680, options [nop,nop,TS val 298320656 ecr 1263310], length 0
06:14:32.474852 IP (tos 0x0, ttl 108, id 2501, offset 0, flags [none], proto TCP (6), length 116)
    74.125.177.35.43242 > 10.150.0.6.22: Flags [P.], cksum 0xae09 (correct), seq 64:128, ack 65, win 32680, options [nop,nop,TS val 298320887 ecr 1263310], length 64
06:14:32.475105 IP (tos 0x10, ttl 64, id 42743, offset 0, flags [DF], proto TCP (6), length 116)
    10.150.0.6.22 > 74.125.177.35.43242: Flags [P.], cksum 0x06a3 (incorrect -> 0x349d), seq 65:129, ack 128, win 405, options [nop,nop,TS val 1263371 ecr 298320887], length 64
06:14:32.489971 IP (tos 0x0, ttl 108, id 2516, offset 0, flags [none], proto TCP (6), length 52)
    74.125.177.35.43242 > 10.150.0.6.22: Flags [.], cksum 0x9417 (correct), seq 128, ack 129, win 32680, options [nop,nop,TS val 298320902 ecr 1263371], length 0
06:14:32.641228 IP (tos 0x0, ttl 108, id 2654, offset 0, flags [none], proto TCP (6), length 116)
    74.125.177.35.43242 > 10.150.0.6.22: Flags [P.], cksum 0x76fa (correct), seq 128:192, ack 129, win 32680, options [nop,nop,TS val 298321053 ecr 1263371], length 64
06:14:32.641484 IP (tos 0x10, ttl 64, id 42744, offset 0, flags [DF], proto TCP (6), length 116)
    10.150.0.6.22 > 74.125.177.35.43242: Flags [P.], cksum 0x06a3 (incorrect -> 0x0f01), seq 129:193, ack 192, win 405, options [nop,nop,TS val 1263413 ecr 298321053], length 64
06:14:32.656335 IP (tos 0x0, ttl 108, id 2661, offset 0, flags [none], proto TCP (6), length 52)
    74.125.177.35.43242 > 10.150.0.6.22: Flags [.], cksum 0x92c6 (correct), seq 192, ack 193, win 32680, options [nop,nop,TS val 298321069 ecr 1263413], length 0
06:14:32.918525 IP (tos 0x0, ttl 108, id 2858, offset 0, flags [none], proto TCP (6), length 116)
    74.125.177.35.43242 > 10.150.0.6.22: Flags [P.], cksum 0x52bb (correct), seq 192:256, ack 193, win 32680, options [nop,nop,TS val 298321331 ecr 1263413], length 64
06:14:32.918774 IP (tos 0x10, ttl 64, id 42745, offset 0, flags [DF], proto TCP (6), length 116)
    10.150.0.6.22 > 74.125.177.35.43242: Flags [P.], cksum 0x06a3 (incorrect -> 0xa889), seq 193:257, ack 256, win 405, options [nop,nop,TS val 1263482 ecr 298321331], length 64
06:14:32.933628 IP (tos 0x0, ttl 108, id 2870, offset 0, flags [none], proto TCP (6), length 52)
    74.125.177.35.43242 > 10.150.0.6.22: Flags [.], cksum 0x90ec (correct), seq 256, ack 257, win 32680, options [nop,nop,TS val 298321346 ecr 1263482], length 0
06:14:33.241993 IP (tos 0x0, ttl 108, id 3101, offset 0, flags [none], proto TCP (6), length 116)
    74.125.177.35.43242 > 10.150.0.6.22: Flags [P.], cksum 0xfdef (correct), seq 256:320, ack 257, win 32680, options [nop,nop,TS val 298321654 ecr 1263482], length 64
06:14:33.242250 IP (tos 0x10, ttl 64, id 42746, offset 0, flags [DF], proto TCP (6), length 116)
    10.150.0.6.22 > 74.125.177.35.43242: Flags [P.], cksum 0x06a3 (incorrect -> 0xcc65), seq 257:321, ack 320, win 405, options [nop,nop,TS val 1263563 ecr 298321654], length 64
06:14:33.257116 IP (tos 0x0, ttl 108, id 3110, offset 0, flags [none], proto TCP (6), length 52)
    74.125.177.35.43242 > 10.150.0.6.22: Flags [.], cksum 0x8ed8 (correct), seq 320, ack 321, win 32680, options [nop,nop,TS val 298321669 ecr 1263563], length 0
06:14:33.399563 IP (tos 0x0, ttl 108, id 3230, offset 0, flags [none], proto TCP (6), length 116)
    74.125.177.35.43242 > 10.150.0.6.22: Flags [P.], cksum 0x214e (correct), seq 320:384, ack 321, win 32680, options [nop,nop,TS val 298321812 ecr 1263563], length 64
06:14:33.399838 IP (tos 0x10, ttl 64, id 42747, offset 0, flags [DF], proto TCP (6), length 116)
    10.150.0.6.22 > 74.125.177.35.43242: Flags [P.], cksum 0x06a3 (incorrect -> 0x7a4b), seq 321:385, ack 384, win 405, options [nop,nop,TS val 1263602 ecr 298321812], length 64
06:14:33.414691 IP (tos 0x0, ttl 108, id 3235, offset 0, flags [none], proto TCP (6), length 52)
    74.125.177.35.43242 > 10.150.0.6.22: Flags [.], cksum 0x8d93 (correct), seq 384, ack 385, win 32680, options [nop,nop,TS val 298321827 ecr 1263602], length 0
06:14:33.547871 IP (tos 0x0, ttl 108, id 3298, offset 0, flags [none], proto TCP (6), length 116)
    74.125.177.35.43242 > 10.150.0.6.22: Flags [P.], cksum 0xcd43 (correct), seq 384:448, ack 385, win 32680, options [nop,nop,TS val 298321960 ecr 1263602], length 64
06:14:33.552622 IP (tos 0x10, ttl 64, id 42748, offset 0, flags [DF], proto TCP (6), length 116)
    10.150.0.6.22 > 74.125.177.35.43242: Flags [P.], cksum 0x06a3 (incorrect -> 0xe1d8), seq 385:449, ack 448, win 405, options [nop,nop,TS val 1263641 ecr 298321960], length 64
06:14:33.554674 IP (tos 0x10, ttl 64, id 42749, offset 0, flags [DF], proto TCP (6), length 212)
    10.150.0.6.22 > 74.125.177.35.43242: Flags [P.], cksum 0x0703 (incorrect -> 0xe1a0), seq 449:609, ack 448, win 405, options [nop,nop,TS val 1263641 ecr 298321960], length 160
06:14:33.567486 IP (tos 0x0, ttl 108, id 3310, offset 0, flags [none], proto TCP (6), length 52)
    74.125.177.35.43242 > 10.150.0.6.22: Flags [.], cksum 0x8c53 (correct), seq 448, ack 449, win 32680, options [nop,nop,TS val 298321980 ecr 1263641], length 0
06:14:33.569507 IP (tos 0x0, ttl 108, id 3311, offset 0, flags [none], proto TCP (6), length 52)
    74.125.177.35.43242 > 10.150.0.6.22: Flags [.], cksum 0x8bb1 (correct), seq 448, ack 609, win 32680, options [nop,nop,TS val 298321982 ecr 1263641], length 0
06:14:35.106208 IP (tos 0x0, ttl 108, id 4572, offset 0, flags [none], proto TCP (6), length 116)
    74.125.177.35.43242 > 10.150.0.6.22: Flags [P.], cksum 0x2409 (correct), seq 448:512, ack 609, win 32680, options [nop,nop,TS val 298323518 ecr 1263641], length 64
06:14:35.106459 IP (tos 0x10, ttl 64, id 42750, offset 0, flags [DF], proto TCP (6), length 116)
    10.150.0.6.22 > 74.125.177.35.43242: Flags [P.], cksum 0x06a3 (incorrect -> 0x0b81), seq 609:673, ack 512, win 405, options [nop,nop,TS val 1264029 ecr 298323518], length 64
06:14:35.121352 IP (tos 0x0, ttl 108, id 4576, offset 0, flags [none], proto TCP (6), length 52)
    74.125.177.35.43242 > 10.150.0.6.22: Flags [.], cksum 0x839d (correct), seq 512, ack 673, win 32680, options [nop,nop,TS val 298323534 ecr 1264029], length 0
06:14:35.309980 IP (tos 0x0, ttl 108, id 4632, offset 0, flags [none], proto TCP (6), length 116)
    74.125.177.35.43242 > 10.150.0.6.22: Flags [P.], cksum 0xefa4 (correct), seq 512:576, ack 673, win 32680, options [nop,nop,TS val 298323722 ecr 1264029], length 64
06:14:35.310218 IP (tos 0x10, ttl 64, id 42751, offset 0, flags [DF], proto TCP (6), length 116)
    10.150.0.6.22 > 74.125.177.35.43242: Flags [P.], cksum 0x06a3 (incorrect -> 0x9d0a), seq 673:737, ack 576, win 405, options [nop,nop,TS val 1264080 ecr 298323722], length 64
06:14:35.325057 IP (tos 0x0, ttl 108, id 4633, offset 0, flags [none], proto TCP (6), length 52)
    74.125.177.35.43242 > 10.150.0.6.22: Flags [.], cksum 0x821f (correct), seq 576, ack 737, win 32680, options [nop,nop,TS val 298323737 ecr 1264080], length 0
06:14:35.389270 IP (tos 0x0, ttl 108, id 4649, offset 0, flags [none], proto TCP (6), length 116)
    74.125.177.35.43242 > 10.150.0.6.22: Flags [P.], cksum 0x0ff7 (correct), seq 576:640, ack 737, win 32680, options [nop,nop,TS val 298323801 ecr 1264080], length 64
06:14:35.389574 IP (tos 0x10, ttl 64, id 42752, offset 0, flags [DF], proto TCP (6), length 116)
    10.150.0.6.22 > 74.125.177.35.43242: Flags [P.], cksum 0x06a3 (incorrect -> 0xc8ba), seq 737:801, ack 640, win 405, options [nop,nop,TS val 1264100 ecr 298323801], length 64
06:14:35.404488 IP (tos 0x0, ttl 108, id 4663, offset 0, flags [none], proto TCP (6), length 52)
    74.125.177.35.43242 > 10.150.0.6.22: Flags [.], cksum 0x813b (correct), seq 640, ack 801, win 32680, options [nop,nop,TS val 298323817 ecr 1264100], length 0
06:14:35.733717 IP (tos 0x0, ttl 108, id 4915, offset 0, flags [none], proto TCP (6), length 116)
    74.125.177.35.43242 > 10.150.0.6.22: Flags [P.], cksum 0xb58a (correct), seq 640:704, ack 801, win 32680, options [nop,nop,TS val 298324146 ecr 1264100], length 64
06:14:35.734004 IP (tos 0x10, ttl 64, id 42753, offset 0, flags [DF], proto TCP (6), length 116)
    10.150.0.6.22 > 74.125.177.35.43242: Flags [P.], cksum 0x06a3 (incorrect -> 0x6f32), seq 801:865, ack 704, win 405, options [nop,nop,TS val 1264186 ecr 298324146], length 64
06:14:35.748889 IP (tos 0x0, ttl 108, id 4921, offset 0, flags [none], proto TCP (6), length 52)
    74.125.177.35.43242 > 10.150.0.6.22: Flags [.], cksum 0x7f0d (correct), seq 704, ack 865, win 32680, options [nop,nop,TS val 298324161 ecr 1264186], length 0
06:14:35.841851 IP (tos 0x0, ttl 108, id 5005, offset 0, flags [none], proto TCP (6), length 116)
    74.125.177.35.43242 > 10.150.0.6.22: Flags [P.], cksum 0x29e5 (correct), seq 704:768, ack 865, win 32680, options [nop,nop,TS val 298324254 ecr 1264186], length 64
06:14:35.842096 IP (tos 0x10, ttl 64, id 42754, offset 0, flags [DF], proto TCP (6), length 116)
    10.150.0.6.22 > 74.125.177.35.43242: Flags [P.], cksum 0x06a3 (incorrect -> 0x35d7), seq 865:929, ack 768, win 405, options [nop,nop,TS val 1264213 ecr 298324254], length 64
06:14:35.856944 IP (tos 0x0, ttl 108, id 5007, offset 0, flags [none], proto TCP (6), length 52)
    74.125.177.35.43242 > 10.150.0.6.22: Flags [.], cksum 0x7e06 (correct), seq 768, ack 929, win 32680, options [nop,nop,TS val 298324269 ecr 1264213], length 0
06:14:37.408114 IP (tos 0x0, ttl 108, id 5142, offset 0, flags [none], proto TCP (6), length 116)
    74.125.177.35.43242 > 10.150.0.6.22: Flags [P.], cksum 0x0a98 (correct), seq 768:832, ack 929, win 32680, options [nop,nop,TS val 298325820 ecr 1264213], length 64
06:14:37.408368 IP (tos 0x10, ttl 64, id 42755, offset 0, flags [DF], proto TCP (6), length 116)
    10.150.0.6.22 > 74.125.177.35.43242: Flags [P.], cksum 0x06a3 (incorrect -> 0x0995), seq 929:993, ack 832, win 405, options [nop,nop,TS val 1264604 ecr 298325820], length 64
06:14:37.423234 IP (tos 0x0, ttl 108, id 5147, offset 0, flags [none], proto TCP (6), length 52)
    74.125.177.35.43242 > 10.150.0.6.22: Flags [.], cksum 0x75e1 (correct), seq 832, ack 993, win 32680, options [nop,nop,TS val 298325835 ecr 1264604], length 0
06:14:37.548463 IP (tos 0x0, ttl 64, id 14949, offset 0, flags [DF], proto TCP (6), length 52)
    10.150.0.6.55710 > 172.217.13.74.443: Flags [.], cksum 0xc4e5 (incorrect -> 0xa56d), seq 4145514691, ack 1970844354, win 271, options [nop,nop,TS val 1264640 ecr 815991643], length 0
06:14:37.549347 IP (tos 0x40, ttl 127, id 0, offset 0, flags [DF], proto TCP (6), length 52)
    172.217.13.74.443 > 10.150.0.6.55710: Flags [.], cksum 0x96bf (correct), seq 1, ack 1, win 261, options [nop,nop,TS val 816006747 ecr 1253303], length 0
06:14:37.674287 IP (tos 0x0, ttl 108, id 5221, offset 0, flags [none], proto TCP (6), length 116)
    74.125.177.35.43242 > 10.150.0.6.22: Flags [P.], cksum 0xef51 (correct), seq 832:896, ack 993, win 32680, options [nop,nop,TS val 298326086 ecr 1264604], length 64
06:14:37.674551 IP (tos 0x10, ttl 64, id 42756, offset 0, flags [DF], proto TCP (6), length 116)
    10.150.0.6.22 > 74.125.177.35.43242: Flags [P.], cksum 0x06a3 (incorrect -> 0xe982), seq 993:1057, ack 896, win 405, options [nop,nop,TS val 1264671 ecr 298326086], length 64
06:14:37.689388 IP (tos 0x0, ttl 108, id 5237, offset 0, flags [none], proto TCP (6), length 52)
    74.125.177.35.43242 > 10.150.0.6.22: Flags [.], cksum 0x7413 (correct), seq 896, ack 1057, win 32680, options [nop,nop,TS val 298326102 ecr 1264671], length 0
06:14:37.850343 IP (tos 0x0, ttl 108, id 5311, offset 0, flags [none], proto TCP (6), length 116)
    74.125.177.35.43242 > 10.150.0.6.22: Flags [P.], cksum 0x3c59 (correct), seq 896:960, ack 1057, win 32680, options [nop,nop,TS val 298326263 ecr 1264671], length 64
06:14:37.850588 IP (tos 0x10, ttl 64, id 42757, offset 0, flags [DF], proto TCP (6), length 116)
    10.150.0.6.22 > 74.125.177.35.43242: Flags [P.], cksum 0x06a3 (incorrect -> 0x97e2), seq 1057:1121, ack 960, win 405, options [nop,nop,TS val 1264715 ecr 298326263], length 64
06:14:37.865466 IP (tos 0x0, ttl 108, id 5313, offset 0, flags [none], proto TCP (6), length 52)
    74.125.177.35.43242 > 10.150.0.6.22: Flags [.], cksum 0x72b7 (correct), seq 960, ack 1121, win 32680, options [nop,nop,TS val 298326278 ecr 1264715], length 0
06:14:37.949052 IP (tos 0x0, ttl 108, id 5346, offset 0, flags [none], proto TCP (6), length 116)
    74.125.177.35.43242 > 10.150.0.6.22: Flags [P.], cksum 0x13ae (correct), seq 960:1024, ack 1121, win 32680, options [nop,nop,TS val 298326361 ecr 1264715], length 64
06:14:37.949672 IP (tos 0x10, ttl 64, id 42758, offset 0, flags [DF], proto TCP (6), length 228)
    10.150.0.6.22 > 74.125.177.35.43242: Flags [P.], cksum 0x0713 (incorrect -> 0xd014), seq 1121:1297, ack 1024, win 405, options [nop,nop,TS val 1264740 ecr 298326361], length 176
06:14:37.964542 IP (tos 0x0, ttl 108, id 5353, offset 0, flags [none], proto TCP (6), length 52)
    74.125.177.35.43242 > 10.150.0.6.22: Flags [.], cksum 0x714b (correct), seq 1024, ack 1297, win 32680, options [nop,nop,TS val 298326377 ecr 1264740], length 0
06:14:41.132460 IP (tos 0x0, ttl 64, id 53460, offset 0, flags [DF], proto TCP (6), length 52)
    10.150.0.6.56930 > 172.217.5.234.443: Flags [.], cksum 0xbd85 (incorrect -> 0xc4a6), seq 3486240798, ack 3880663178, win 270, options [nop,nop,TS val 1265536 ecr 2132116767], length 0
06:14:41.134050 IP (tos 0x40, ttl 127, id 0, offset 0, flags [DF], proto TCP (6), length 52)
    172.217.5.234.443 > 10.150.0.6.56930: Flags [.], cksum 0xd382 (correct), seq 1, ack 1, win 261, options [nop,nop,TS val 2132131872 ecr 1246635], length 0
06:14:45.000007 IP (tos 0x0, ttl 108, id 11179, offset 0, flags [none], proto TCP (6), length 116)
    74.125.177.160.58580 > 10.150.0.6.22: Flags [P.], cksum 0x597f (correct), seq 2187259734:2187259798, ack 2298291767, win 8059, options [nop,nop,TS val 3878022082 ecr 247542], length 64
06:14:45.000971 IP (tos 0x10, ttl 64, id 6168, offset 0, flags [DF], proto TCP (6), length 116)
    10.150.0.6.22 > 74.125.177.160.58580: Flags [P.], cksum 0x0720 (incorrect -> 0x9bdd), seq 1:65, ack 64, win 396, options [nop,nop,TS val 1266503 ecr 3878022082], length 64
06:14:45.016046 IP (tos 0x0, ttl 108, id 11191, offset 0, flags [none], proto TCP (6), length 52)
    74.125.177.160.58580 > 10.150.0.6.22: Flags [.], cksum 0x23e1 (correct), seq 64, ack 65, win 8059, options [nop,nop,TS val 3878022098 ecr 1266503], length 0
06:14:45.201160 IP (tos 0x0, ttl 108, id 11314, offset 0, flags [none], proto TCP (6), length 116)
    74.125.177.160.58580 > 10.150.0.6.22: Flags [P.], cksum 0x727c (correct), seq 64:128, ack 65, win 8059, options [nop,nop,TS val 3878022283 ecr 1266503], length 64
06:14:45.201414 IP (tos 0x10, ttl 64, id 6169, offset 0, flags [DF], proto TCP (6), length 116)
    10.150.0.6.22 > 74.125.177.160.58580: Flags [P.], cksum 0x0720 (incorrect -> 0x85f1), seq 65:129, ack 128, win 396, options [nop,nop,TS val 1266553 ecr 3878022283], length 64
06:14:45.216208 IP (tos 0x0, ttl 108, id 11326, offset 0, flags [none], proto TCP (6), length 52)
    74.125.177.160.58580 > 10.150.0.6.22: Flags [.], cksum 0x2267 (correct), seq 128, ack 129, win 8059, options [nop,nop,TS val 3878022298 ecr 1266553], length 0
06:14:45.236990 IP (tos 0x0, ttl 108, id 11336, offset 0, flags [none], proto TCP (6), length 116)
    74.125.177.160.58580 > 10.150.0.6.22: Flags [P.], cksum 0xfc0b (correct), seq 128:192, ack 129, win 8059, options [nop,nop,TS val 3878022319 ecr 1266553], length 64
06:14:45.237318 IP (tos 0x10, ttl 64, id 6170, offset 0, flags [DF], proto TCP (6), length 116)
    10.150.0.6.22 > 74.125.177.160.58580: Flags [P.], cksum 0x0720 (incorrect -> 0xd194), seq 129:193, ack 192, win 396, options [nop,nop,TS val 1266562 ecr 3878022319], length 64
06:14:45.256609 IP (tos 0x0, ttl 108, id 11341, offset 0, flags [none], proto TCP (6), length 52)
    74.125.177.160.58580 > 10.150.0.6.22: Flags [.], cksum 0x21b5 (correct), seq 192, ack 193, win 8059, options [nop,nop,TS val 3878022339 ecr 1266562], length 0
06:14:45.902295 IP (tos 0x0, ttl 108, id 11568, offset 0, flags [none], proto TCP (6), length 116)
    74.125.177.160.58580 > 10.150.0.6.22: Flags [P.], cksum 0x1363 (correct), seq 192:256, ack 193, win 8059, options [nop,nop,TS val 3878022984 ecr 1266562], length 64
06:14:45.902538 IP (tos 0x10, ttl 64, id 6171, offset 0, flags [DF], proto TCP (6), length 116)
    10.150.0.6.22 > 74.125.177.160.58580: Flags [P.], cksum 0x0720 (incorrect -> 0x257a), seq 193:257, ack 256, win 396, options [nop,nop,TS val 1266728 ecr 3878022984], length 64
06:14:45.917289 IP (tos 0x0, ttl 108, id 11575, offset 0, flags [none], proto TCP (6), length 52)
    74.125.177.160.58580 > 10.150.0.6.22: Flags [.], cksum 0x1dfb (correct), seq 256, ack 257, win 8059, options [nop,nop,TS val 3878022999 ecr 1266728], length 0
06:14:46.181011 IP (tos 0x0, ttl 108, id 11633, offset 0, flags [none], proto TCP (6), length 116)
    74.125.177.160.58580 > 10.150.0.6.22: Flags [P.], cksum 0x492b (correct), seq 256:320, ack 257, win 8059, options [nop,nop,TS val 3878023263 ecr 1266728], length 64
06:14:46.181261 IP (tos 0x10, ttl 64, id 6172, offset 0, flags [DF], proto TCP (6), length 116)
    10.150.0.6.22 > 74.125.177.160.58580: Flags [P.], cksum 0x0720 (incorrect -> 0xbf64), seq 257:321, ack 320, win 396, options [nop,nop,TS val 1266798 ecr 3878023263], length 64
06:14:46.196008 IP (tos 0x0, ttl 108, id 11638, offset 0, flags [none], proto TCP (6), length 52)
    74.125.177.160.58580 > 10.150.0.6.22: Flags [.], cksum 0x1c1e (correct), seq 320, ack 321, win 8059, options [nop,nop,TS val 3878023278 ecr 1266798], length 0
06:14:46.364730 IP (tos 0x0, ttl 108, id 11797, offset 0, flags [none], proto TCP (6), length 116)
    74.125.177.160.58580 > 10.150.0.6.22: Flags [P.], cksum 0x8256 (correct), seq 320:384, ack 321, win 8059, options [nop,nop,TS val 3878023447 ecr 1266798], length 64
06:14:46.364986 IP (tos 0x10, ttl 64, id 6173, offset 0, flags [DF], proto TCP (6), length 116)
    10.150.0.6.22 > 74.125.177.160.58580: Flags [P.], cksum 0x0720 (incorrect -> 0xbcdb), seq 321:385, ack 384, win 396, options [nop,nop,TS val 1266844 ecr 3878023447], length 64
06:14:46.379718 IP (tos 0x0, ttl 108, id 11802, offset 0, flags [none], proto TCP (6), length 52)
    74.125.177.160.58580 > 10.150.0.6.22: Flags [.], cksum 0x1ab8 (correct), seq 384, ack 385, win 8059, options [nop,nop,TS val 3878023462 ecr 1266844], length 0
06:14:48.421985 IP (tos 0x0, ttl 108, id 13490, offset 0, flags [none], proto TCP (6), length 116)
    74.125.177.160.58580 > 10.150.0.6.22: Flags [P.], cksum 0x2600 (correct), seq 384:448, ack 385, win 8059, options [nop,nop,TS val 3878025504 ecr 1266844], length 64
06:14:48.422329 IP (tos 0x10, ttl 64, id 6174, offset 0, flags [DF], proto TCP (6), length 116)
    10.150.0.6.22 > 74.125.177.160.58580: Flags [P.], cksum 0x0720 (incorrect -> 0xd1d0), seq 385:449, ack 448, win 396, options [nop,nop,TS val 1267358 ecr 3878025504], length 64
06:14:48.437091 IP (tos 0x0, ttl 108, id 13498, offset 0, flags [none], proto TCP (6), length 52)
    74.125.177.160.58580 > 10.150.0.6.22: Flags [.], cksum 0x102d (correct), seq 448, ack 449, win 8059, options [nop,nop,TS val 3878025519 ecr 1267358], length 0
06:14:48.493755 IP (tos 0x0, ttl 108, id 13526, offset 0, flags [none], proto TCP (6), length 116)
    74.125.177.160.58580 > 10.150.0.6.22: Flags [P.], cksum 0x4df0 (correct), seq 448:512, ack 449, win 8059, options [nop,nop,TS val 3878025576 ecr 1267358], length 64
06:14:48.494037 IP (tos 0x10, ttl 64, id 6175, offset 0, flags [DF], proto TCP (6), length 116)
    10.150.0.6.22 > 74.125.177.160.58580: Flags [P.], cksum 0x0720 (incorrect -> 0x8ec4), seq 449:513, ack 512, win 396, options [nop,nop,TS val 1267376 ecr 3878025576], length 64
06:14:48.508782 IP (tos 0x0, ttl 108, id 13535, offset 0, flags [none], proto TCP (6), length 52)
    74.125.177.160.58580 > 10.150.0.6.22: Flags [.], cksum 0x0f53 (correct), seq 512, ack 513, win 8059, options [nop,nop,TS val 3878025591 ecr 1267376], length 0
06:14:49.063354 IP (tos 0x0, ttl 108, id 13662, offset 0, flags [none], proto TCP (6), length 116)
    74.125.177.160.58580 > 10.150.0.6.22: Flags [P.], cksum 0x2af7 (correct), seq 512:576, ack 513, win 8059, options [nop,nop,TS val 3878026145 ecr 1267376], length 64
06:14:49.063811 IP (tos 0x10, ttl 64, id 6176, offset 0, flags [DF], proto TCP (6), length 116)
    10.150.0.6.22 > 74.125.177.160.58580: Flags [P.], cksum 0x0720 (incorrect -> 0x05f0), seq 513:577, ack 576, win 396, options [nop,nop,TS val 1267518 ecr 3878026145], length 64
06:14:49.078594 IP (tos 0x0, ttl 108, id 13672, offset 0, flags [none], proto TCP (6), length 52)
    74.125.177.160.58580 > 10.150.0.6.22: Flags [.], cksum 0x0c0b (correct), seq 576, ack 577, win 8059, options [nop,nop,TS val 3878026161 ecr 1267518], length 0
06:14:49.236240 IP (tos 0x0, ttl 108, id 13674, offset 0, flags [none], proto TCP (6), length 116)
    74.125.177.160.58580 > 10.150.0.6.22: Flags [P.], cksum 0xebb9 (correct), seq 576:640, ack 577, win 8059, options [nop,nop,TS val 3878026318 ecr 1267518], length 64
06:14:49.236523 IP (tos 0x10, ttl 64, id 6177, offset 0, flags [DF], proto TCP (6), length 116)
    10.150.0.6.22 > 74.125.177.160.58580: Flags [P.], cksum 0x0720 (incorrect -> 0xc0a1), seq 577:641, ack 640, win 396, options [nop,nop,TS val 1267562 ecr 3878026318], length 64
06:14:49.251324 IP (tos 0x0, ttl 108, id 13679, offset 0, flags [none], proto TCP (6), length 52)
    74.125.177.160.58580 > 10.150.0.6.22: Flags [.], cksum 0x0ab3 (correct), seq 640, ack 641, win 8059, options [nop,nop,TS val 3878026333 ecr 1267562], length 0
06:14:49.387304 IP (tos 0x0, ttl 108, id 13750, offset 0, flags [none], proto TCP (6), length 116)
    74.125.177.160.58580 > 10.150.0.6.22: Flags [P.], cksum 0x2be5 (correct), seq 640:704, ack 641, win 8059, options [nop,nop,TS val 3878026469 ecr 1267562], length 64
06:14:49.387561 IP (tos 0x10, ttl 64, id 6178, offset 0, flags [DF], proto TCP (6), length 116)
    10.150.0.6.22 > 74.125.177.160.58580: Flags [P.], cksum 0x0720 (incorrect -> 0xc7f2), seq 641:705, ack 704, win 396, options [nop,nop,TS val 1267599 ecr 3878026469], length 64
06:14:49.402355 IP (tos 0x0, ttl 108, id 13757, offset 0, flags [none], proto TCP (6), length 52)
    74.125.177.160.58580 > 10.150.0.6.22: Flags [.], cksum 0x0977 (correct), seq 704, ack 705, win 8059, options [nop,nop,TS val 3878026484 ecr 1267599], length 0
06:14:49.430871 IP (tos 0x0, ttl 108, id 13765, offset 0, flags [none], proto TCP (6), length 116)
    74.125.177.160.58580 > 10.150.0.6.22: Flags [P.], cksum 0xcb10 (correct), seq 704:768, ack 705, win 8059, options [nop,nop,TS val 3878026513 ecr 1267599], length 64
06:14:49.431676 IP (tos 0x10, ttl 64, id 6179, offset 0, flags [DF], proto TCP (6), length 116)
    10.150.0.6.22 > 74.125.177.160.58580: Flags [P.], cksum 0x0720 (incorrect -> 0x1a3b), seq 705:769, ack 768, win 396, options [nop,nop,TS val 1267610 ecr 3878026513], length 64
06:14:49.434874 IP (tos 0x10, ttl 64, id 6180, offset 0, flags [DF], proto TCP (6), length 116)
    10.150.0.6.22 > 74.125.177.160.58580: Flags [P.], cksum 0x0720 (incorrect -> 0x5e08), seq 769:833, ack 768, win 396, options [nop,nop,TS val 1267611 ecr 3878026513], length 64
06:14:49.449649 IP (tos 0x0, ttl 108, id 13774, offset 0, flags [none], proto TCP (6), length 52)
    74.125.177.160.58580 > 10.150.0.6.22: Flags [.], cksum 0x087c (correct), seq 768, ack 833, win 8059, options [nop,nop,TS val 3878026532 ecr 1267610], length 0
06:14:50.319377 IP (tos 0x0, ttl 108, id 13827, offset 0, flags [none], proto TCP (6), length 116)
    74.125.177.160.58580 > 10.150.0.6.22: Flags [P.], cksum 0xd8e2 (correct), seq 768:832, ack 833, win 8059, options [nop,nop,TS val 3878027401 ecr 1267610], length 64
06:14:50.319539 IP (tos 0x10, ttl 64, id 6181, offset 0, flags [DF], proto TCP (6), length 116)
    10.150.0.6.22 > 74.125.177.160.58580: Flags [P.], cksum 0x0720 (incorrect -> 0x8343), seq 833:897, ack 832, win 396, options [nop,nop,TS val 1267832 ecr 3878027401], length 64
